{"$schema":"https://json-schema.org/draft/2020-12/schema","title":"MSLO run metadata","type":"object","required":["run_id","schema_version","mode","started_at_utc","status"],"properties":{"run_id":{"$ref":"common.schema.json#/$defs/runId"},"schema_version":{"type":"string"},"mode":{"$ref":"common.schema.json#/$defs/mode"},"started_at_utc":{"$ref":"common.schema.json#/$defs/utcTimestamp"},"ended_at_utc":{"$ref":"common.schema.json#/$defs/utcTimestamp"},"status":{"type":"string"},"minecraft_version":{"type":"string"},"mod_loader":{"type":"string"},"mod_loader_version":{"type":"string"},"minecraft_instance":{"type":"string"},"notes":{"type":"string"}},"additionalProperties":false}
